id,title_romaji,description,description_source
132312,Hua Jianghu: Gui Yexing Part 2,"This is a story about growth, friendship and passion. Through the continuous improvement of racing skills, the in-depth understanding of the concept of racing, the understanding of the meaning of life and the friendship of friends, the originally ambitious racer Yeji Dong has gradually grown into the most reliable partner, and will gradually grow into the most powerful racer...

(Source: V2Anime)",jikan_mal
132381,Huyao Xiao Hongniang: Yue Hong 2,"The story centers on Dongfang Yuechu and Tushan Honghong, recounting their love story from 500 years ago. Young Dongfang Yuechu mistakenly enters Tushan, where he lives as a ""lowly servant."" Years later, to fulfill Tushan Honghong's wish—peaceful coexistence between humans and demons—Dongfang Yuechu resolutely leaves Tushan to join the Yi Qi Dao Alliance, becoming its leader. However, just when everything seems to be progressing smoothly, danger is slowly approaching…

(Source: Tencent, translated)",jikan_mal
132444,Shinkai no Survival!,Second movie of Kagaku Manga Surivival learning manga.,jikan_mal
132459,Huangshang Jixiang,,not_found
132460,Gebi You Zhi Taohua Yao,"In the late 21st century, mysterious structures known as ""Nightmare Domes"" began to appear all over the world, causing a global crisis. The only thing that could stop them was the ""Swan"", an idol's singing voice.

In order to counter this threat, the United Nations has created the special divison ""IDUN"", or ""Idols Disciplined to Unpurified Nightmare"". Six young girls from various corners of the world (Seika, Tamamo, Rose, Isabella, Katya and Mo Xi) have been selected, taking on the various challenges along the way. Whenever the peace is disturbed, it is up to them (and you, the audience) to fight together.

(Source: VTuber Wiki)",jikan_mal
132461,Jueshi Zhan Hun,"The Xuanling Sect, the head of the four major sects, came to Shuicheng to select disciples for the first time in many years. The Fang and Qin families started fighting openly and secretly around this opportunity that would determine their fate. In the end, Qin Nan relied on his dedicated training, excellent talent, and the God of War Soul obtained by chance, and under the fair judgment of the messenger Xiao Qingxue, he successfully reversed the decline and defeated the Fang family. 

After entering the sect, Qin Nan aroused the hatred of Ouyang Jun, the son of the sect leader, because of his involvement in Xiao Qingxue's forced marriage. In order to continue to become stronger and repay Xiao Qingxue's kindness, Qin Nan repeatedly defeated powerful enemies, won the first place in the Wanxiang Competition and the Outer Sect Competition, entered the Wuyuan Pavilion with the four major sect geniuses, and obtained the power to stir up the continent. 

A shocking secret, an appointment with Leng Feng to fight in the Palace of Life and Death, overcoming the siege of Linshui City by the Beihai family, exploring the Nine-Character Mantra Tower, and vowing to fight the evil forces of the sect to the end. 

(Source: iQIYI, Google translated)",jikan_mal
132468,Over!,"A recap film with some new scenes.

The Sky Pirate Fam and Millia (the princess who Fam rescued as her Turan Kingdom faced devastation) wage a battle against the Ades Federation that reduced Turan to ashes, and aim to establish a revived Turan Kingdom.

(Source: ANN)",jikan_mal
132470,Jidao Zongshi,"Legend has it that the Dragon God is sitting in the realm of the gods, and if he is the inheritor of the gods, he will become the new ruler of China. The various sects and gangs are gradually fighting over the inheritance of the Dragon God. The protagonist, Chu Qianye, was regarded as the son of a sinner because of his father's loss of the treasure of the sect. A subtle connection was made.

(Source: Youku, translated)",jikan_mal
132471,Qiang Huo Tian Ling,,not_found
132472,Xianwu Dizun,"As a loyal disciple, Ye Chen dedicated himself to guard the spiritual medicine field for his sect. But, during a fight with enemies, the spiritual field was destroyed. His loyalty and dedicating to the sect could not save him. The loyalty he thought he had obtained from his peers and lover, could not save him from betrayal. Thus, he was shamelessly banished from the sect. With the help of a flame falling from heaven, Ye Chen began to develop himself into a stronger cultivator. Battled against his opponents, unfolded his legendary life and rewrote his own story...",jikan_mal
132479,Wei Jin Xiao Juchang,,not_found
132516,"Shixiong, Qing An Juben Lai!","Transmigrating to a cultivation world only to find himself not fitting the protagonist's character description, Dongfang Xianyun mistakenly identifies his second junior brother, Yin Feixing, who has been reborn for revenge, as the ""protagonist."" Intending to cling to the protagonist's coattails to survive, he is instead kicked off a cliff by his ""cog,"" thus embarking on the path of a demonic cultivator villain. Characters such as the naive and innocent Mahayana-stage demonic cultivator Yi Xiangfeng, the playboy Dongfang Wuqiong, the eldest disciple of the Xuanming Sect, and the Heavenly Dao Messenger Bu Suantian, also a transmigrator, all make their appearance. The Demon Subduing Assembly brings together a storm of events, and the battle between righteous and demonic cultivators is about to erupt. Dongfang Xianyun, the former eldest disciple of the Xiaoyao Sect and now the senior demonic cultivator of the Bai Mei Sect, is caught in a life-or-death crisis…

(Source: Bilibili, translated)",jikan_mal
132698,Oshiri Tantei: Sufuure-tou no Himitsu,"The story follows Butt Detective and his assistant Brown as they solve a difficult case on Souffle Island, where people ride the wind and fly in the sky.

(Source: Comic Natalie, translated)",jikan_mal
132893,Battle Spirits: Mirage,Sequel to Battle Spirits: Kakumei no Galette.,jikan_mal
133483,Anette-san to Liliana-san THE ANIMATION,,not_found
133774,Jiu Tian Xuan Di Jue,"Of all the races in the world only 3 stand at the top. Each race possesses a master of the martial arts, a Golden Martial God. The balance of power appears to be shifting after Wang Fan's brother is killed triggering a chain of events that will begin to turn the world upside down. Disguising himself as the Silver Tiger King, Wang Fan becomes a symbol of power and the hope of the human race.

Some days Wang Fan is a boy genius that tries to blend in as a smart but helpless student. Other days he becomes a powerful tiger. Every race has their eyes on the Silver Tiger King as he continues to surpass every precedent and excel far beyond his peers all while under the guise of an unassuming student.",jikan_mal
135576,Zongyou Yaoguai Xiang Hai Zhen,"Alina Clover becomes an adventurers' guild receptionist, believing that—unlike the adventurers who risk their lives every day to conquer dungeons—she will enjoy a safe and comfortable career with plenty of benefits. She hates overtime work more than anything, longing for the day when she can finally clock out on time. Sadly, that day has yet to come, as she must constantly trudge through piles upon piles of paperwork.

To make matters worse, when adventurers take too long to subjugate a dungeon boss, the backlog only grows, forcing Alina into even more overtime. Whenever her patience runs thin, she dons a disguise and takes care of the boss herself, soon gaining infamy as the enigmatic ""Executioner."" Alina has managed to keep this secret for two years—until she finishes off a boss assigned to the high-ranking party Silver Sword. Unfortunately for her, the party's eagle-eyed leader, Jade Scrade, deduces her identity, jeopardizing the receptionist's dream of a carefree life.

[Written by MAL Rewrite]",jikan_mal
135864,Tropical-Rouge! Precure: Yuki no Princess to Kiseki no Yubiwa!,"The story takes place in the wintry land of Shantia, with Manatsu and the others invited to the land by its princess Sharon. But as they arrive, a mysterious monster attacks Shantia, and it is closed off to outsiders.

(Source: ANN)",jikan_mal
136049,Chizuru-chan Kaihatsu Nikki,An honor student who finds herself blackmailed by a scrotum professor who takes her virginity and does various perverse things.,jikan_mal
136135,ColoColo Animal Otogibanashi,,not_found
136163,Lianai Shang Shang Qian,,not_found
136165,Qian Wu Gu Ren,Seventh season of Wu Dong Qian Kun.,jikan_mal
136221,Riku wa Yowakunai,"Based on Sakagami's own life, the story follows the carefree daily lives of a 5-year-old and a puppy named Riku. In addition to the Italian greyhound Riku, the characters include the chihuahua Tsutomu, the miniature dachshund Yousuke, the French bulldog Maruchan, and the pug Paguzоou.

(Source: ANN)",jikan_mal
136309,Ling Yun Daima,"In 2048, the Lingyun system, as the first case of ""smart brain popularization application"", will be tried out in the city of Mirage. The accident at the Lingyun system conference that day triggered an emotional entanglement between its founders Zhou Tong, Zhao Feibai, and childhood friends Ayigul, Aizmat. In order to achieve his goals, Zhou Tong closed the ""brain consciousness"" of Zhao Feibai, Ayigul and Aizmat in the sandbox space of the Lingyun system, but inadvertently triggered the system's ""initial intelligent AI"" ------Lucoco's start. Everything is connected to the ""imprint"" game in the memories of the four people that year, an intelligence crisis with the code of ""human heart fetters"" unfolding between the real and virtual worlds.

(Source: qq.com)",jikan_mal
136397,Xiao Hua Da Dianying: Qiji Shaonü,,not_found
136452,Kyoto Animation: Souzou-hen,,not_found
136657,Sansan De Shenghuo Guoran You Wenti,,not_found
137678,Renjian Zui Deyi,"Six thousand years later, the once prosperous Sword Stream had declined, relying only on the Sword God Chao Qingqiu to support the current Swordsman Flow to fight the twelve saints of the Three Streams. Li Fuyao had great hatred. To make a living by telling a story in a small town, go to Jianshan, go to the land of the devil, and go to the land of Buddhism. After taking revenge, I realized that there was a huge conspiracy all over the world. Why did the Sword Stream begin to decline six thousand years ago? Why couldn’t the saints and Sword Gods of six thousand years be unable to obtain Immortality? Why did Chao Qingqiu live in the world with suspended animation? What exactly are lanterns in Buddhism? Is the dragon in the Land of Devils a visitor from the outside world? What’s there? All these things unfolded step by step as Li Fuyao continued to grow.

(Source: Animexin)",jikan_mal
137729,Dou Po Cangqiong: San Nian Zhi Yue,"Three years ago, Nalan Yanran, the young sect leader of the Yunlan Sect, rashly broke off her engagement. Feeling deeply humiliated, Xiao Yan made a three-year pact with Nalan Yanran. For this pact, Xiao Yan cultivated tirelessly, enduring trials from the Magical Beast Mountain Range to the Tagor Desert, from alchemy to the excruciating pain of absorbing a strange fire—all to prove the saying: ""Thirty years east of the river, thirty years west of the river; never underestimate a young man's potential."" Now, the men of the Xiao family will rise to the challenge, never retreating. Xiao Yan's path of growth continues…

(Source: Tencent, translated)",jikan_mal
137983,Jia You,,not_found
138064,Wo Qi Ku Le Baiwan Xiulianzhe,"The story is about a student, Jiangbei, who fought valiantly at the subway station and was blessed by the system. Fortunately, he hosts the system and travels to another world. In this different world filled with cultivators, Jiangbei had gone from being a trash in a small town to a genius child in everyone's eyes. Relying on the system, Jiangbei had started the path of improvement and became stronger just by playing treasures, and upsetting people. After a series of chaos and poetry battles, Jiangbei gradually developed feelings for his relatives here.

(Source: Animexin)",jikan_mal
138550,Biohazard Village × Ningyou Geki,"The series is about a missing genius whose mysterious disappearance becomes a shady secret among the successful members of society.

(source: MAL News)",jikan_mal
138658,Cosplay Change: Pure-kei Joshidaisei no Kiken na Seiheki,"Aima Imoko is a young college student with a hobby of cosplay. Luckily there is a cosplay shop near her where she would like to try on a few outfits. On site she meets a hardcore otaku shop owner who also cosplays. Both are deep in their roles and she is a bit revealing, what are they supposed to do?",jikan_mal
139436,Bu Baichi Hua Shanhai Jing,,not_found
139811,Zhen Dao Ge Specials,"The story rewinds thirteen years, recounting the massacre of the entire He family, except for the young He Fangzhi, at a mutton soup restaurant in the Gobi Desert. Those involved in the massacre are familiar faces He Fangzhi encounters thirteen years later seeking revenge: Luo Tong, Hong Niang, the Unjust Monk, Long Shun, and Uncle Jian. This nighttime killing exposes the hidden beliefs and personal motives of each member of the murder squad, culminating in Uncle Jian's agonizing choice between ""family and country"" and ""loyalty and duty""... In this carnage, will they truly achieve their goals? Is Uncle Jian's choice worthwhile...?

(Source: Tencent, translated)",jikan_mal
140101,Benghuai 3: Qian Qishilu,"Familiar tunes resonate in our dreamland.
Dance! A myriad of musical notes converge to become spectacular fireflies that illuminate our collective memories.

(Source: Official Honkai Impact 3rd YouTube channel)",jikan_mal
140252,Hongse Jiangshan: Huangma Fenghuo,,not_found
140363,Shinya Haikai,Animated music video for the song Shinya Haikai by Shannon feat. GUMI.,jikan_mal
140377,Cogimyun 2nd,"The series centers on the flour dough spirit Cogimyun, who actually really wants to be an onigiri. She takes care of her grandfather's apartment complex due to her grandfather being away. The denizens of the apartment are all ""Kogimuko,"" which are all food that center on flour dough. 

(Source: ANN)",jikan_mal
140645,Fanren Xiu Xian Zhuan: Modao Zhengfeng,"A poor and ordinary boy from a village joins a minor sect in Jiang Hu and becomes an Unofficial Disciple by chance. How will Han Li, a commoner by birth, establish a foothold for himself in in his sect? With his mediocre aptitude, he must successfully traverse the treacherous path of cultivation and avoid the notice of those who may do him harm. This is a story of an ordinary mortal who, against all odds, clashes with devilish demons and ancient celestials in order to find his own path towards immortality.

(Source: Wuxia World)",jikan_mal
140788,Taimanin Shiranui: Inyoku no Dorei Shoufu,"This series tells about Shiranui, the mother of Mizuki Yukikaze, who went on a mission and disappeared, since then nothing has been known about her for five years. Time passed, and her daughter Yukikaze, together with Rinko and her brother, came to the solution of the possible location of Shiranui. In the new episode, we will see how she was captured, raped and sexually trained to become a first-class whore.  

(Source: ZIZ)",jikan_mal
141309,Zhu Dick: Lan Hai Qi Yuan,Final season of Zhu Xian.,jikan_mal
142178,Jian Yu Chuanqi,"In the ancient sword domain continent, there are ten Excalibur and five families. One of the five families, Lu Yang, a descendant of the Lu family, in a crisis to escape from the pursuit of the moment of awakening the sacred sword ""Peach God sword"", to avoid the pursuit. He kept a low profile, practiced hard, avenged his mother, explored the truth, in the various big clans between the forces of the struggle mediation, and finally dominate the world! Ten swords, ask the sword domain continent. ""The Legend Of Sword Domain""

(Source: Narul Donghua)",jikan_mal
142458,SOS! Chao Wei Zhichang Ren,,not_found
142716,Wan Yu Feng Shen,"Yun Fei Xue's father, Yun Tiangang, and his brother, Yun Fei Shan, were tragically assassinated eight years ago during a mission to escort a dragon vein. Only the young Yun Feixue is left in the Yun family’s bloodline, and Yun Feixue is also mysterious. Parasitized by power, that power unexpectedly merged with Yun Feixue, and transformed into a phantom exactly like him. The phantom was parasitized in Yun Feixue's consciousness, and he was always ready to accumulate power and devour his soul. Yun Feixue, who had just suppressed the phantom in his body, received the sad news of his father and brother's tragic death. He was idle in the dark, but behind his back he gathered an organization called ""Shadow"" to secretly investigate the mystery of the year.

(Source: Narul Donghua)",jikan_mal
146347,Dou Hun Wei Zhi Xuan Yue Qi Yuan 5,Fifth season of Dou Hun Wei Zhi Xuan Yue Qiyuan.,jikan_mal
149040,Ooya-san to Boku 3,The third season of Ooya-san to Boku.,jikan_mal
154974,Argonavis Movie: Ryuusei no Obligato,Compilation of Argonavis from BanG Dream! with new cuts.,jikan_mal
155201,Shouhu Lian Meng ROY6: Baobao Senlin De Maoxian,,not_found
157074,Etotama: Nyankyaku Banrai - Etotama Pretty Gekijou,Short anime included in Blu-ray release of Etotama: Nyankyaku Banrai.,jikan_mal
180850,Ankoku Kazoku Warabi-san,"The dark comedy follows Mrs. Warabi's family, who are unable to suppress their desires and tend to repeat the same mistakes in their lives.

(Source: ANN)",jikan_mal
181468,"Kumo no Ue wa Itsumo, Hare",,not_found
188077,Luna-ui Mabeobdogam,,not_found
188825,Mini Teukgongdae Super Gongnyong Power: Super Dino 7,"Cute yet mighty! Mini animal rangers transform into super power Force-Bot to save endangered friends!

In the ruthless world of animals, big strong animals dominate and feed on the small and weak. To buck this natural system, small animals form a secret organization ""MINIFORCE."" Rigidly selected mutants with special powers: Volt, Sammy, Lucy and Max become top secret rangers to save their small village Bluebell from the hand of human villain Nein and his underling lizard Pascal.

Animals in danger? No problem! When Force-Gem alerts, it's time to get suit on! With Mini Force and their transforming mechanics, it’s time to sweep! 

(Source: Samg Animation)",jikan_mal
188826,Mini Teukgongdae Animaltron,,not_found
126400,Qian Cong Shou,"Qian Cong, a young man from the country of ""Hua"", is a Squib with a mark but unable to use speech. Even so, he dreams of becoming the strongest speech master and enters the Academy City to study, thus beginning his immortal life.

(Source: Bilibili, translated)",jikan_mal
133661,Zhen Dao Ge: Chenshi Xing,"It revolves around the treacherous struggles between various martial arts sects in Linqing, Shandong. The protagonist, Luo Tong, the young master of the Canal Gang, becomes embroiled in a conspiracy against the gang. Facing the impending annihilation of the gang and the pursuit of numerous other martial arts sects, Luo Tong, with the help of his childhood sweetheart Hong Niang, the master craftsman Jiang Yuan, and the impetuous hero Long Shun, gradually approaches the truth. Each character holds onto their own beliefs and convictions, leading to a series of exhilarating and thrilling battles…

(Source: Tencent, translated)",jikan_mal
133786,Jing Cui Xian Zun,"At the beginning of chaos, the world was divided into three realms: the realm of deities, the realm of men, and the realm of demons. The realm of deities sent a spirit seed down into the world to help the common people. But the spirit seed continuously absorbed the evil of the world and cruelly harmed living things. In the end, Sen Luo, the king of the deities, sacrificed himself and sealed it. However, because of it, the Shangqing Xianmen, where the realm of deities is located, gradually waned and was lost in history. A thousand years later, the ruins of Shangqing Xianmen started to appear in succession. All major sects fought their hardest for possession of the treasures in the ruins.

(Source: Narul Donghua)",jikan_mal
139170,Qi Jie Diyi Xian,"Because of a sudden kindness, Liang Xi has ten thousand years of true power, and joins Tianlingmen to embark on the official path of self-cultivation. Turning your hands into clouds and covering your hands into rain, while talking and laughing, the powerful enemies are wiped out. My wish is very simple. It is nothing more than planting flowers and raising grass, and making bubble girls and refining treasures. Covering the world with one hand, very good and powerful. Liang Xi looked at the sentient beings in the seven realms crawling under her feet, and emphasized that I am a man with a strong sense of chastity.

(Source: Donghua Sub Studio)",jikan_mal
139669,Xi Yangyang Yu Hui Tailang: Kuang Chu Weilai,"The basketball team composed of Xi Yang Yang and Hui Tai Lang failed in the final, but they didn't give up and prepared to participate in the new competition. 

(Source: IMDb)",jikan_mal
140955,Shi Wang Zhe A?,"This season's story takes place at the foot of the Great Wall on the frontier of the King's Continent. To safeguard peace at the border, every character who appears has left their homeland and traveled thousands of miles to this place. Although they are all ""strangers"" on this unfamiliar land, their shared belief gives them a common name—the Great Wall Guards.

(Source: Tencent, translated)",jikan_mal
142116,Garden: Takamine-ke no Nirinka The Animation,"The Servamps and their pact-bound ""Eves"" are finally getting back to their normal lives as they recover from their injuries from the previous battles. However, when it starts snowing in the middle of summer, one of the Eves, Mahiru Shirota, suspects vampiric interference. Concerned by the strange phenomenon, he sets out to gather the group once more to try and solve the mystery; however, they suddenly lose contact with Misono Arisuin, the Eve of the Servamp of Lust.

Servamp Movie: Alice in the Garden delves into the untold past of Misono and his brother Mikuni Arisuin, as well as the many mysteries of the grand Arisuin Mansion.

[Written by MAL Rewrite]",jikan_mal
142216,Garugaku. II: Lucky Stars,"Sequel of Gal-gaku.: Hijiri Girls Square Gakuin, featuring Lucky2 as the cast.",jikan_mal
142553,Women De Dong Ao,,not_found
143065,Yamitsuki Mura / Melty Limit The Animation,"A reporter travels to a village where there are rumors about supernatural things happening... But, will he be the next victim?",jikan_mal
143483,Mao Xian Dong De Shou,"Nicknamed Xiao Wan, having social anxiety for twenty years, has been stammering in public but is witty and eloquent in private. She desperately wants to develop ""social butterfly syndrome"" but fails, ultimately choosing to stay home. Fortunately, she has six unique cats: a Maine Coon, a Ragdoll, a Siamese, a fat orange Tabby, a hairless Garfield, and others. They are companions, understanding, playful rivals, and deeply inseparable. Though Xiao Wan has few friends, her heart is not lonely. (In other words, she doesn't want to go out; she just wants to stay home all day cuddling with her cats!)

(Source: Douban, translated)",jikan_mal
143620,Xiao Hu Dun Da Yingxiong,,not_found
144852,Aka-chan Honbuchou 2nd Season,The second season of Akachan Honbuchou.,jikan_mal
145814,Yong Mei,"Star is born to run over the heads of the fainting people. When he witnesses a ""premeditated"" fainting event, he decides to set up an agency. Together with his close friend Dazhi, they'll help the people who want to know the truth and explore the meaning of existence.

(Source: bilibili, translated)",jikan_mal
145823,Xian Yu Ge Specials,,not_found
146554,Jifeng Jingshe,,not_found
146887,Nanako Zhichang Da Zuozhan,,not_found
149346,Gon De Hanta: Tata Turan Xiangdao 2,,not_found
151779,Xiong Chumo: Chongfan Diqiu,"Bramble has always dreamed of becoming a great hero in order to gain recognition from everyone, especially his older brother, Briar. A piece of the alien nucleus that fell from the sky broke the peace of Pine Tree Mountain, but unexpectedly, Bramble merged with the alien nucleus and became a bear with alien wisdom and energy. However, this also brought about the pursuit of ""alien"" Abu who wanted to reclaim the nucleus.

(Source. Wikipedia)",jikan_mal
170013,Penetrate Blue: Vapor Trail Another Age 2824,,not_found
184374,Jin Shancheng Cai Qiu Hua Hui Yi Shi: 2022 Bainian Ji Dan Pin,"In an alternate history, following World War II, civil unrest and terrorism run rampant in a devastated Japan under foreign occupation. During a botched interception of underground munitions being transferred by a terrorist organization, Constable Kazuki Fuse, a soldier in an elite counter-terrorism unit, witnesses the true terror of human nature. He fails to prevent a teenage girl from carrying out a desperate suicide bombing that subsequently causes immense destruction to Tokyo. With mental scars and his competence under question, Fuse is sent back to the military academy for re-evaluation. Unbeknownst to him, he will soon be caught up in a web of government conspiracies that have the power to determine the future of all of Japan.

As Fuse treads the fine line between human and beast, he ultimately discovers to which side he truly belongs.

[Written by MAL Rewrite]",jikan_mal
122522,Huanmeng Shan Hai Yao,"A girl named Chu Yao was pulled into the mythical world of mountains and seas by an inexplicable force. There are endless magnificent territories and countless magical beings, but also unpredictable dangers and ruthless divine law. Who is it that pulled her into this world, and what will be her fate here? Is it to fight against the whole world and become a legend; or to integrate into this world and make the world of mountains and seas a legend...

(Source: v.qq.com)",jikan_mal
122531,Hun Hou Richang,,not_found
